{
  "$schema": "https://json-schema.org/draft/2020-12/schema",
  "$id": "https://contracts.wotaotao.com/events/commerce.order.settlement-eligible.v1/envelope.schema.json",
  "title": "OrderSettlementEligible envelope v1",
  "type": "object",
  "properties": {
    "eventId": {
      "type": "string",
      "minLength": 1,
      "description": "Stable evt_ identifier",
      "pattern": "^evt_[A-Za-z0-9_-]+$"
    },
    "eventType": {
      "type": "string",
      "const": "OrderSettlementEligible"
    },
    "schemaVersion": {
      "type": "integer",
      "const": 1
    },
    "occurredAt": {
      "type": "string",
      "format": "date-time",
      "description": "Business occurrence time"
    },
    "publishedAt": {
      "type": "string",
      "format": "date-time",
      "description": "Outbox publication time"
    },
    "producer": {
      "type": "string",
      "const": "SYS-02"
    },
    "environment": {
      "type": "string",
      "enum": [
        "DEV",
        "TEST",
        "STAGING",
        "PROD"
      ]
    },
    "audience": {
      "type": "array",
      "items": {
        "type": "string",
        "enum": [
          "SYS-03",
          "SYS-06",
          "SYS-08"
        ]
      },
      "minItems": 1,
      "uniqueItems": true
    },
    "enterpriseId": {
      "anyOf": [
        {
          "type": "string",
          "minLength": 1,
          "description": "Stable ent_ identifier",
          "pattern": "^ent_[A-Za-z0-9_-]+$"
        },
        {
          "type": "null"
        }
      ]
    },
    "aggregateType": {
      "type": "string",
      "const": "SubOrder"
    },
    "aggregateId": {
      "type": "string",
      "minLength": 1,
      "description": "Stable aggregate identifier"
    },
    "aggregateVersion": {
      "type": "integer",
      "minimum": 1,
      "description": "Monotonic aggregate version"
    },
    "traceId": {
      "type": "string",
      "minLength": 1
    },
    "causationId": {
      "anyOf": [
        {
          "type": "string",
          "minLength": 1,
          "description": "Stable evt_ identifier",
          "pattern": "^evt_[A-Za-z0-9_-]+$"
        },
        {
          "type": "null"
        }
      ]
    },
    "correlationId": {
      "type": "string",
      "minLength": 1
    },
    "idempotencyKey": {
      "type": "string",
      "minLength": 1,
      "description": "Stable business idempotency key; unchanged on retry"
    },
    "payload": {
      "type": "object",
      "properties": {
        "orderId": {
          "type": "string",
          "minLength": 1,
          "description": "Stable ord_ identifier",
          "pattern": "^ord_[A-Za-z0-9_-]+$"
        },
        "subOrderId": {
          "type": "string",
          "minLength": 1,
          "description": "Stable subord_ identifier",
          "pattern": "^subord_[A-Za-z0-9_-]+$"
        },
        "sellerEnterpriseId": {
          "type": "string",
          "minLength": 1,
          "description": "Stable ent_ identifier",
          "pattern": "^ent_[A-Za-z0-9_-]+$"
        },
        "eligibilityVersion": {
          "type": "integer",
          "minimum": 1,
          "description": "Monotonically increasing source version"
        },
        "eligibleAt": {
          "type": "string",
          "format": "date-time"
        },
        "eligibilitySnapshotRef": {
          "type": "string",
          "minLength": 1,
          "description": "Stable els_ identifier",
          "pattern": "^els_[A-Za-z0-9_-]+$"
        },
        "eligibilitySnapshotHash": {
          "type": "string",
          "minLength": 1,
          "description": "Lower-case SHA-256 digest",
          "pattern": "^[a-f0-9]{64}$"
        },
        "aftersaleWindowRuleVersion": {
          "type": "integer",
          "minimum": 1,
          "description": "Monotonically increasing source version"
        }
      },
      "required": [
        "orderId",
        "subOrderId",
        "sellerEnterpriseId",
        "eligibilityVersion",
        "eligibleAt",
        "eligibilitySnapshotRef",
        "eligibilitySnapshotHash",
        "aftersaleWindowRuleVersion"
      ],
      "additionalProperties": false,
      "$schema": "https://json-schema.org/draft/2020-12/schema",
      "$id": "https://contracts.wotaotao.com/events/commerce.order.settlement-eligible.v1/payload.schema.json",
      "title": "OrderSettlementEligible payload v1"
    }
  },
  "required": [
    "eventId",
    "eventType",
    "schemaVersion",
    "occurredAt",
    "publishedAt",
    "producer",
    "environment",
    "audience",
    "enterpriseId",
    "aggregateType",
    "aggregateId",
    "aggregateVersion",
    "traceId",
    "causationId",
    "correlationId",
    "idempotencyKey",
    "payload"
  ],
  "additionalProperties": false,
  "description": "subOrderId + eligibilityVersion; source snapshot is immutable",
  "examples": [
    {
      "eventId": "evt_ordersettlementeligible_001",
      "eventType": "OrderSettlementEligible",
      "schemaVersion": 1,
      "occurredAt": "2026-08-10T02:00:00Z",
      "publishedAt": "2026-08-10T02:00:01Z",
      "producer": "SYS-02",
      "environment": "DEV",
      "audience": [
        "SYS-03",
        "SYS-06",
        "SYS-08"
      ],
      "enterpriseId": null,
      "aggregateType": "SubOrder",
      "aggregateId": "subord_contract_001",
      "aggregateVersion": 1,
      "traceId": "trace_contract_fixture_001",
      "causationId": null,
      "correlationId": "corr_contract_fixture_001",
      "idempotencyKey": "ORDER_SETTLEMENT_ELIGIBLE:subord_contract_001:1",
      "payload": {
        "orderId": "ord_contract_001",
        "subOrderId": "subord_contract_001",
        "sellerEnterpriseId": "ent_contract_001",
        "eligibilityVersion": 1,
        "eligibleAt": "2026-08-17T02:00:00Z",
        "eligibilitySnapshotRef": "els_contract_001",
        "eligibilitySnapshotHash": "5555555555555555555555555555555555555555555555555555555555555555",
        "aftersaleWindowRuleVersion": 1
      }
    }
  ],
  "x-topic": "commerce.order.settlement-eligible.v1",
  "x-producer": "SYS-02",
  "x-consumers": [
    "SYS-03",
    "SYS-06",
    "SYS-08"
  ],
  "x-idempotency-key-format": "ORDER_SETTLEMENT_ELIGIBLE:{subOrderId}:{eligibilityVersion}"
}
