{
  "eventId": "evt_ordersettlementeligible_001",
  "eventType": "OrderSettlementEligible",
  "schemaVersion": 1,
  "occurredAt": "2026-08-10T02:00:00Z",
  "publishedAt": "2026-08-10T02:00:01Z",
  "producer": "SYS-02",
  "environment": "DEV",
  "audience": [
    "SYS-03",
    "SYS-06",
    "SYS-08"
  ],
  "enterpriseId": null,
  "aggregateType": "SubOrder",
  "aggregateId": "subord_contract_001",
  "aggregateVersion": 1,
  "traceId": "trace_contract_fixture_001",
  "causationId": null,
  "correlationId": "corr_contract_fixture_001",
  "idempotencyKey": "ORDER_SETTLEMENT_ELIGIBLE:subord_contract_001:1",
  "payload": {
    "orderId": "ord_contract_001",
    "subOrderId": "subord_contract_001",
    "sellerEnterpriseId": "ent_contract_001",
    "eligibilityVersion": 1,
    "eligibleAt": "2026-08-17T02:00:00Z",
    "eligibilitySnapshotRef": "els_contract_001",
    "eligibilitySnapshotHash": "5555555555555555555555555555555555555555555555555555555555555555",
    "aftersaleWindowRuleVersion": 1
  }
}
